<?xml version="1.0" encoding="utf-8"?>
<!-- Created with Liquid XML Studio Developer Edition (Education) 8.1.0.2319 (http://www.liquid-technologies.com) -->
<structureTermsResponse xmlns:gml="http://www.opengis.net/gml/3.2" xmlns:xlink="http://www.w3.org/1999/xlink" xmlns:gmd="http://www.isotc211.org/2005/gmd" xmlns:gco="http://www.isotc211.org/2005/gco" xmlns:gss="http://www.isotc211.org/2005/gss" xmlns:gts="http://www.isotc211.org/2005/gts" xmlns:gsr="http://www.isotc211.org/2005/gsr" xmlns:xsi="http://www.w3.org/2001/XMLSchema-instance" xsi:noNamespaceSchemaLocation="C:\dev_incf_google\atlas-server\trunk\src\main\resources\WaxMlSchema\WaxML_Base.xsd">
    <queryInfo>
        <timeCreated>1998-09-19T09:55:47.49</timeCreated>
        <queryUrl>http://www.liquid-technologies.com</queryUrl>
        <criteria />
    </queryInfo>
    <structureTerms>
        <structureCode isDefault="0" gml:id="AAAAA" codeSpace="http://www.liquid-technologies.com">string</structureCode>
        <name codeSpace="http://www.liquid-technologies.com">string</name>
        <description xlink:role="http://www.liquid-technologies.com" xlink:arcrole="http://www.liquid-technologies.com" gml:remoteSchema="http://www.liquid-technologies.com">string</description>
        <feature>
            <boundedBy>
                <gml:Envelope srsName="http://www.liquid-technologies.com">
                    <gml:pos srsName="http://www.liquid-technologies.com" axisLabels="string string string string string">6963.0149058039</gml:pos>
                    <gml:pos srsName="http://www.liquid-technologies.com" uomLabels="string string string">-7765.5650941961 -4848.9050941961</gml:pos>
                </gml:Envelope>
            </boundedBy>
            <Url>http://www.liquid-technologies.com</Url>
            <format>SimpleFeaturesText</format>
        </feature>
    </structureTerms>
</structureTermsResponse>
